id,severity,description
393293,blocker,"Update Download page for Bugzilla 3.0.1, 3.1.1, 2.22.3, and 2.20.5"
393296,blocker,"Update ""Changes"" Page for Bugzilla 3.0.1, 3.1.1, 2.22.3, and 2.20.5"
393304,blocker,"Create Release Info pages for Bugzilla 3.0.1, 3.1.1 (3.2), 2.22.3, and 2.20.5"
393310,normal,attachment X should not been converted on fly when \n is inserted
393403,normal,Attachment auto-linking probably shouldn't cross newlines
393703,normal,token complaints should happen *after* other sanity checks
393745,trivial,"You will need to ""add at least one component "" before you can enter bugs against this product"
393752,normal,it seems possible to create a group not for bugs and add it to all products
393753,minor,"Go back to the group list is rendered inline with Yes, delete"
393755,major,generated CSV is invalid
393894,normal,Target List on 'Search for bugs' Isn't Sorting According to Milestone Sortkey
394123,trivial,Link to group list redundant on confirmation page for mass-removal
394165,normal,quoted printable utf-8 in email subjects is unreadable
394224,minor,Searching using invalid statuses causes an internal error in Bugzilla
394227,minor,Flagmail subject confused; X-Bugzilla-Type header broken
394350,normal,user with editbugs privs cannot SR attachments
394385,normal,System date in a custom field
394415,normal,Software error occurs when trying to set sslUrl
394574,normal,bzdbcopy should avoid reading entire tables into memory
394627,normal,bzdbcopy.pl should remove column quoting
394796,major,"""I'm added to or removed from this capacity "" for ""CCed"" is overridden by ""The CC field changes"""
394874,normal,checksetup.pl crashes if defaultlanguage is set to 'de'
394951,normal,changing the field names
394953,normal,The FAQ says Bugzilla doesn't support mod_perl yet
394959,trivial,turn votes off by default
395175,normal,"""partial success, partial failure"" message is not explaining problem"
395178,normal,Problem with group membership after migration from 2.18 to 3.0.1
395352,normal,It would be very valuable to have flags visible on buglist overview
395380,normal,whenever i post a bug in bugzilla it gives a error as undef error - Invalid argument at C:/Perl/site/lib/Mail/Mailer.pm line 269.
395403,normal,Some terms in installation.xml cause makedocs.pl to create a x384.html file
395406,normal,The xml file used to generate the API html doc files is not on CVS
395413,normal,"With the Dusk skin, text enclosed in <a name=""""></a> is displayed in blue"
395505,major,Fields with Chinese (and presumably other UTF-8 characters) are garbled in forms on localized web pages
395682,normal,attachment.cgi forms UI html in all cases (even if called from email_in.pl)
395710,blocker,Release of 3.0.2 and 3.1.2
395715,blocker,Security Advisory for 3.0.1 and 3.1.2 Release
395717,critical,Moving bugs crashes Bugzilla due to unlock tables
395834,normal,Column change isn't working
395896,minor,"Hide the ""Short Format"" button in ""Format for Printing"" when printing"
395924,normal,Deleting a user account may delete other user's whine
395951,normal,Unable to search for bugs which requested review in some date range
395973,normal,unable to change assignee/qa_contact even with strict_isolation set to off
395982,normal,how to restrict users to open NEW bugs
396010,normal,Field Values Customisation defaults to lowest sortkey
396104,normal,Dusk skin needs a .cvsignore
396183,major,Receive error below when you try and Reassign and bug.
396376,major,Crash on logout
396413,normal,accepting a new bug does noch change assignee to self
396505,blocker,Release and News Announcement for 3.0.2 and 3.1.2
396506,blocker,Release Notes for 3.0.2
396508,blocker,Update Release Info pages for 3.0.2 and 3.1.2
396563,minor,urlbase generates absolute URL's -
396591,major,Unable to change bug ownership after 2.17 to 3.01 upgrade
396612,blocker,"Update ""Changes"" Page for Bugzilla 3.0.2 and 3.1.2"
396666,trivial,ทดสอบไทย Thai Language  Testing
396692,normal,email_in.pl always using the From address to find the user not always a valid configuration
396858,normal,Start of week
397163,normal,"need null choice for ""where one or more of the following changed"" under Bug Changes"
397665,minor,"""Assigning Group Controls to Products"" doesn't explain editcomponents, canconfirm, editbugs"
397969,major,"""Show last search results"" returns search results from before upgrade from 2.18.3"
398142,critical,In ActiveState-Repositories missed packages Email-Send and more
398167,normal,Actual hours column in buglist.cgi seems wrong a lot of the time
398198,minor,Multiple Bugzilla databases with a single installation docs should have an id
398241,major,mod_perl isn't using our precompiled templates
398250,normal,The Change Columns behaviour seems to be stuck when using FireFox
398370,normal,installation of bugzilla
398420,critical,Midair collision protection is broken
398525,normal,Bugzilla is working on LAN but it is not connected continuously from outside.
398548,critical,Can't locate Bugzilla/Auth/Login/.pm
398600,major,Searching for bugs with a version of --- returns no bugs
398707,normal,whine.pl should use transactions for database interaction
398735,normal,sanitycheck.cgi may check that everconfirmed is correctly set against wrong bug statuses
398739,critical,"""Taking a bug"" while adding a new attachment locks the bug status forever if the ASSIGNED bug status has been renamed or deleted"
398798,minor,checksetup.pl 'commands to install' should quote Perl module names
398879,minor,Logging in after canceling a password-change token throws an error
398883,normal,"[mod_perl] Three Variable ""$cgi"" will not stay shared errors in current CVS HEAD"
398948,normal,editmilestones.cgi should use transactions for database interaction
398968,normal,editversions.cgi should use transactions for database interaction
398976,normal,The edit* cgi scripts should use transactions for database interaction
398986,blocker,Incorrect SQL query when moving bugs to another product
399004,normal,Cannot append a comment to bug via email - crash at Encode.pm
399028,normal,Do not display all pending requests by default when the user is logged out
399370,major,Fulltext search with a LIKE on bugs.short_desc is too slow.
399449,normal,Cannot add dependency to bug I'm not authorized to access
399461,normal,Bugzilla::Hook::process() doesn't flush Bugzilla->hook_args() after executing an extension
399534,minor,Support the ability to change deadline in multiple bugs
399559,minor,LDAP administration is not experimental
399574,normal,relnotes or Bugzilla Guide should note to use 64bit Perl on Win64 too.
399654,major,Entering a bug with strict_isolation doesn't consider group inheritance
399823,normal,nonroot installation instructions tell you to modify files that don't exist
399945,normal,Whinning report doesnt support sorting order in query
399996,normal,don't reject a bug filing if it's filed with an attachment with a different name
400032,minor,"Entry ""Version"" missing in report form"
400132,normal,Performance problem when searching with quicksearch
400140,normal,"cant enter bug for product if i check more then one Entry field on ""Edit Group Controls"" page"
400160,major,contrib/merge-users.pl doesn't merge all required fields
400308,normal,Same results are displayed when i use search for all alphabetics
400569,normal,Bugzilla::Bug::editable_bug_fields() behaves incorrectly on installations with custom multi-select fields
400629,normal,"The ""User Preferences"" doc page has no information about saved searches"
400631,normal,"The ""Account History"" page in editusers.cgi is not documented"
400677,normal,Documentation about products is mostly non-existent
400678,minor,Default CC list for components not mentioned in the documentation
401098,minor,Duplicates numbers no less than the bug number
401347,normal,Template.pm has $datadir in wrong place
401453,normal,Internal Server Error when viewing a bug
401672,major,"perl email_in.pl - Bareword ""ON_WINDOWS"" not allowed while ""strict subs"" in use at Bugzilla/Install/Localconfig.pm line 66."
401789,trivial,Tables don't have good identifiers for use with css
402438,normal,Invalid deadlines can be set by unauthorized users
402638,minor,"When committing, bugzilla rejects keywords that are not in some list. If there is a restrictied set, please make this field a popup or dropdown list of some sort."
402640,minor,"To edit a bug with comment, only the first three records display in both bug interface and Format for Printting like in View Activity."
402643,normal,Whining doesn't work.
402874,minor,Entering a new bug into bugzilla should show the summary in the header.
402909,normal,cannot turn on empty words on find specific bugs page
403038,normal,System:Null Reference Exception:A Null value was found where an object was required
403094,normal,votes to confirm minimum should be 2
403477,normal,Bug Activity does NOT trac votes
403755,normal,DBI error thrown when you cannot edit a bug which is in a product restricted by CANEDIT
403762,normal,Bugzilla is not taking  IST Timezone
403791,normal,Apostrophe in the description is causing the text to be truncated.
404008,normal,cant login Avinash
404009,normal,"Buglist sort order, when sorted by changed date"
404141,major,rrfrefsrewfsdf
404276,critical,Related to Functional
404338,normal,Query Defaults on/off setting does not work
404412,normal,Cannot reply to comments anymore
404581,minor,add_setting() incorrectly handles settings with no values
404705,normal,on clicking download games not working
405342,normal,"""My requests"" is broken"
405350,critical,"Email is broken on tip, ""can't send mail from '1' to '1'"""
405362,major,Emails with UTF-8 in the body cause email sending to die
405444,normal,garbaged? charactors in encoded
405453,normal,bugzilla should encode X-Bugzilla header contents.
405476,normal,flag:review? not understood by QuickSearch
405713,normal,Columnlist is ignored for cookies
405787,normal,product_access_denied error tag defined twice in user-error.html.tmpl
405788,normal,$bug->add_comment incorrectly calls check_can_change_field()
405946,normal,whine.txt.tmpl - email template in custom folder will not be used
405955,normal,Know the Feature of Bugzilla
405970,minor,checksetup.pl is really slow when there's nothing to do
405987,normal,Column width seems to be in bytes and not in 'number of characters'
406398,normal,truncation to invalid UTF-8 character for the « Name » set in « User Preferences » when displayed at various pages
406468,normal,bug summaries gets squized between « Bugzilla – Bug nnnn » and « Last modified: ... »
406992,normal,Add Software Test & Performance's winner logo to bugzilla.org
407036,normal,buglist.css no longer loaded by buglists
407061,normal,syntec touchpad signal 11 crashes when rebooting or shutdown
407402,normal,"Bugzilla should die if it can't read data/params, but it isn't dying"
408037,major,[Oracle] Running checksetup.pl twice doesn't work
408151,major,error 'install_data_too_long' does not defined on checksetup.pl
408172,normal,Query bugs at https://landfill.bugzilla.org/bugzilla-tip-oracle/ not working
408177,normal,Documentation of Template Customization outdated
408212,normal,When using IE (Internet Explore) Users forced to re-login each time
408259,normal,midair collisions should only allow people w/ editbugs to force submit
408337,major,"Result of ""Change Columns"" should be text/html, not text/plain"
408766,normal,Apache::DBI is a premature optimization that causes trouble
409463,normal,The flagtypes.description DB format is not the same in an upgraded installation and in a fresh one
409593,minor,namedqueries.query_type has the wrong definition in DB::Schema
409598,normal,Our version numbering needs to be explained in UPGRADING-pre-2.8
409667,normal,User.login should check that it has all parameters
409682,normal,Whine should not add headers for queries with 0 bugs
410053,normal,limit user search
410182,critical,Bugzilla crashes when moving a bug into another product when no QA contact is defined and strict_isolation is enabled
410208,trivial,Can confirm own bug by popular vote
410504,normal,Bugzilla_login cookie not sent
410524,normal,createCalendar() and showCalendar() undefined after attaching a file
410717,blocker,Release Bugzilla 3.0.3
410769,blocker,Status Update for 3.0.3
410770,blocker,"Update ""Download"" Page for 3.0.3"
410773,blocker,"Update ""Changes"" Page for 3.0.3"
410775,blocker,Release/News Announcement for 3.0.3
410779,blocker,Release Notes for 3.0.3
410796,normal,review and approval emails still wrap lines in subject
410823,major,Multi-select fields values are not editable.
410836,normal,Field name missing in error message when trying to add an already existing field value.
410859,normal,createCalendar() and showCalendar() undefined in post_bug
410889,normal,scheda audio
410902,normal,Some characters are mangled in diff and interdiff modes when viewing attachment
411209,normal,HTML attachments can be used to hijack Bugzilla sessions via XSS
411240,major,URL link not available in bug mails after bugzilla upgrade to latest stable version
411328,normal,editmilestone.cgi and three .css files lack explicit MPL license notices
411437,normal,"Clipping of ""Free Text"" when user enters more then 255 characters."
411459,normal,interface
411460,normal,bug
411544,normal,unnecessary line breaks and excessive indentation in email subject lines
411662,normal,sss
411832,normal,[Oracle] Change query in  table series back to MEDIUMTEXT and ISOLATION_LEVEL to 'READ COMMITTED'
411910,normal,install-module.pl abort by oracle DB_MODULE
412053,normal,Bugzilla should disable sending emails to accounts that has been disabled
412059,normal,"""Impersonate this user"" link on editusers.cgi uses incorrect filter"
412227,normal,interface
412487,blocker,Release Bugzilla 3.1.3
412500,blocker,"Update ""Download"" Page for 3.1.3"
412501,blocker,"Update ""Changes"" Page for 3.1.3"
412503,blocker,Release/News Announcement for 3.1.3
412538,normal,eror MYSQL
412548,minor,[PATCH] Allow the user to choose Ogg Video attachment from dropdown menu
412578,normal,Software error  with Email::Mime module on resending mail reported using Sanity Check
412621,normal,commit button doesn't work after using back button to correct a problem
412783,critical,if you execute checksetup.pl then an error with Cwd.so: strlcpy occurs.
412943,normal,"When email_in.pl call process_bug.cgi, no qa_contact field causes update failure"
412976,minor,"""Bug"" should be replaced with $terms.Bug in user-error.html.tmpl"
413149,minor,There is twice the same paragraph bz_canusewhines in using.xml
413163,normal,sanitycheck.pl needs to be more helpful when run at command line
413258,normal,"When setting a flag on an attachment on bug creation, an incorrect message is displayed"
413343,minor,"Requesting data for a bug restricted to a group while you are logged out throws ""Error 32000"""
413482,normal,stats not updated - charts show constant bug counts
413672,normal,email_in.pl incorrectly rejects quoted charsets
413722,normal,Combine login cookies into single cookie and add signature to cookie
413921,normal,Should be able to change resolution of several bugs at once without reopening
413948,minor,Adding/removing Opened column displays Html code instead of the actual page
414002,normal,Temporary files for uploaded attachments are not deleted on Windows
414012,major,Updating attachments.description fails to give enough info to fix the problems it finds
414267,major,show bug UI broken after editing an attachment
414281,normal,editvalues.cgi variables badly scoped under mod_perl
414284,major,New bug edit page is a nightmare for triagers
414382,normal,New show_bug UI - CC List Checkbox duplicated
414430,normal,"On Windows, checksetup.pl should mention the correct PPM repo based on the Perl version"
414474,normal,Remove debugging code from Search.pm
414552,major,Cannot change resolution for multiple issues at once
414604,normal,"After inserting/editing/deleting an attachment, the Keywords field is unavailable"
414726,critical,Bugzilla::Update never updates bugzilla-update.xml if the file already exists locally
414775,normal,[Oracle] Error occurs when displaying Assignee and Assignee Realname together.
414786,trivial,Un necessary text being displayed while zooming in or out.
415287,normal,Keyword select widget does not update values/becomes out of sync after browser fills in form after hitting back
415396,normal,does not let me log into account
415471,major,A user without canconfirm privs can enter bugs in the NEW/ASSIGNED status using XML-RPC
415528,normal,crashes
415539,minor,Remove trailing whitespaces from bugmail
415544,critical,Mass-change erases all values from custom multi-select fields
415605,major,checksetup.pl thinks Email::Send is not installed
415652,major,Bugzilla->get_fields() must cache all fields and let Perl return matching data
415663,normal,Flag->snapshot() calls Flag->match() with attach_id being undefined
415676,minor,All unqualified mentions of the landfill ppm repos should be updated
415714,normal,logincookies table not correctly upgraded from 2.21.1
415796,major,All webservice methods fail if a string has non-ASCII characters in it
415862,trivial,Comments relating to $bug_re in variables.none.tmpl out of date
415973,minor,"variables.none.tmpl incorrectly states 'Changing this will not affect ""linkification"" of your new terms.'"
416047,minor,"CPAN.pm makes test 1 fail for Bugzilla/Install/CPAN.pm and, in turn, install-module.pl"
416118,major,HTTP POSTs are slow
416126,normal,Hide deprecated versions
416481,major,No bugmail is sent if no comment is added on bug creation
416784,trivial,Wrong parameter in configuration documentation at createuser in PostgreSQL
416902,normal,"crash if I create new bug, or add comment - at file Encodings.pm line 26"
416991,normal,"First use of ""Old Charts"" feature after call to ./collectstats.pl results in Software Error"
417030,normal,importxml.pl doesn't support custom fields implemented in 3.2
417048,normal,Boolean charts let me query for users being in any given group
417146,normal,Sanitycheck recurses into global/message.txt.tmpl
417187,normal,Oracle.pm:prepare does not work
417188,major,Can't post a comment to bug 417184
417190,normal,Oracle-error when Inserting into bz_schema with version as String
417360,major,Attactchment is deleted after commit.
417438,trivial,Show products on first (login) page by default
417505,blocker,Release Bugzilla 3.1.4 and 3.0.4
417507,normal,Implement bug 352436 into HEAD
417521,blocker,Status Update for 3.0.4 and 3.1.4
417522,blocker,"Update ""Download"" Page for 3.0.4 and 3.1.4"
417523,blocker,"Update ""Changes"" Page for 3.0.4 and 3.1.4"
417529,blocker,Release/News Announcement for 3.0.4 and 3.1.4
417531,blocker,Release Notes for 3.0.4
417540,normal,update windows install instructions
417639,normal,Wide-char characters are not recognized in image-charts
417656,normal,"Mail always display ""Email sent to  no one "" when I commit/assigned a bug!"
418042,normal,updating fails
418399,normal,Bookmarkable template triggers double file logic
418672,normal,email_in.pl should use realpath to avoid working from /etc/smrsh
418709,normal,Hook.process() does not work properly inside of a template BLOCK
418786,normal,"""Take assignment"" in attachment screen moves bug to ASSIGNED state, even if that state doesn't exist"
418863,major,Bugzilla 3.0.x lets you mark bugs as VERIFIED or CLOSED with no resolution
418895,minor,Assignee and QA contact fields always become revealed
418930,major,"email_in.pl doesn't handle quotes around charset item in content-type header - ""Unknown encoding"" error"
418965,major,cannot create a bug for a new product
419188,blocker,email_in.pl lets you do changes as if you were someone else
419191,blocker,CC'ed users not being in the group a bug is restricted to cannot do any change
419243,blocker,get_new_status_and_resolution is missing from Bug.pm
419388,minor,"004template.t should fall back to ""en"""
419440,trivial,The Bugzilla version is not displayed in the welcome-admin page
419660,normal,"New custom fields not listed in ""3.10. Custom Fields"""
419748,normal,Need to hook deleting products
420322,normal,there is no action for getting details without editing
420684,minor,No DOCTYPE in generated HTML for duplicates.cgi
420821,major,Bugzilla 3.0 does not wrap CJK comment text in BugMail
420836,major,Error occurs on creating new user
421045,normal,Watching users email sent even if user disabled
421046,normal,Remove GPL/LGPL options from any tri-licensed files
421064,normal,[Oracle] cron scripts collectstats.pl (ORA error) and whine.pl (crash) don't work
421111,major,Attachment is not added with a NEW bug if you CC someone.
421264,normal,[Oracle] parameter 'usemenuforusers' switched on fails to fill user lists / works on mySQL
421273,normal,Problems with .dat-attachments
421450,normal,install
421856,major,"""Wide character"" error when send mail!"
421931,minor,Group control identifiers on product edit page should be localizable
422111,major,Merging users fails to update regexp-based group memberships
422256,normal,email_in.pl should send an email if user matching fails or returns too many results
422439,normal,wrong version of MySQL reported by checksetup.pl
422690,normal,Attachment comments do not save
422691,normal,"Attachment gets added twice after hitting ""Back"" and ""Refresh"""
422935,normal,Status values for “Take Bug” functionality on attachment creation not localizable
423078,trivial,"Advanced Search ""any one of"" wording wrong"
423346,major,importxml.pl fails when importing attachments
423496,normal,Move Documentation generation to xmlto from jade etc.
423613,normal,extern_id is not unique in DB schema
423733,normal,mail_delivery_method = 'Test' doesn't generate a valid mbox file
423777,minor,Keywords - Changes don't appear until a refresh
423795,normal,repetition-operator operand invalid error when using certain characters in a regexp search
423959,normal,The Dusk skin should wrap too long lines in table headers
424100,normal,Windows install instructions need updating for Perl 5.10
424380,major,Bugzilla 3.0 lets you clear the resolution of resolved bugs
424865,minor,checksetup tells me that commands listed below need to be run as root
424961,normal,local dependency graphing requires additional symlink
424990,normal,"""Last modified"" isn't changed when one vote for it"
425039,normal,Allow required_date in columnlist= and order= URL parameters
425110,blocker,Security Advisory for Bugzilla 3.0.4 and 3.1.4
425288,normal,"checksetup.pl displays messages using the first language available, alphabetically"
425565,normal,Product name not displayed in the error message when adding/removing bugs to/from illegal groups
425620,minor,checksetup.pl doesn't pick up the user's language correctly
425702,normal,Search did not find defect with search terms in defect summary
425746,normal,Bugzilla::Template::precompile_templates() doesn't flush template_include_path_ correctly
426036,minor,Changing the component of a resolved bug does not (let) reassign Assigned To / QA Contact.
426211,trivial,invalid get_status call
426461,normal,HTML tags within Description text
426695,normal,Bugzilla Installation problem(DBD:Mysql:st Execute Failed)
426899,major,All webservice methods fail if a string has upper-ASCII characters in it
427219,minor,"The ""Reset QA Contact to default"" checkbox remains bold when editing the component"
427226,minor,Do not display the requestee field if the flag is not requestable
427236,trivial,Different font sizes used in the group restrictions section of show_bug.cgi
427459,normal,selenium test suite for BZ 3.2 written in perl
427604,normal,Extra leading dot '.' being added to comment lines in notification emails
428069,normal,internal error when clicking on the duplicate radio button without supplying a ticket id
428285,normal,process_bug.cgi still prone to CSRF
428289,normal,"pop3 is not working , because port number is not correct"
428319,normal,contrib/bz_webservice_demo.pl fail
428383,blocker,Release Notes for 2.22.4
428384,blocker,Release Notes for 2.20.6
428414,major,ActivePerl 5.10 users are effectively locked out
428511,minor,Status and resolution values in dependency trees not localizable
428569,normal,The CGI module's package name is CGI.pm
428607,normal,Path for extension template hooks are wrong
428637,normal,Documentation doesn't build on Perl 5.10
428659,normal,Setting SSL param to 'authenticated sessions' only protects logins
428800,minor,"""Download a Bugzilla tarball"" should be linkified"
428955,normal,[question] Multiple apache servers working with one bugzilla DB
429378,normal,collectstats.pl fails if ./graphs is a symlink
429626,trivial,editgroups.cgi incorrectly states that bug group names cannot contain spaces (regression of bug 119005)
429633,normal,Add CC should search against real names as well as email addresses
429767,normal,short_desc label is controlled by check_can_change_field('alias')
429768,minor,show_bug_flags is needlessly set twice in edit.html.tmpl
429816,minor,Severity not saved in bookmarkable template
429818,minor,HTML validation error in the bug creation form due to missing ID for custom free text field
430011,normal,Disabled extensions are still included in template include path
430012,normal,Templates in extensions are not precompiled
430013,normal,@INC behaviour is non-obvious for extensions
430088,normal,opt out of weekly reminders
430098,major,Cannot open bug as RESOLVED
430137,normal,My Requests link displays empty list of bugs
430307,normal,unsafe regexp used in global/userselect.html.tmpl
430554,normal,"Bugzilla patch diffs don't show lines starting with ""-"""
430630,critical,"Can not see bug's description, comments on browser"
431143,trivial,data/mail and data/mimedump-tmp no longer in use
