id,severity,description
551068,trivial,Dropdown box not user readable after scrolling
551104,major,People get asked about pg_config by install-module.pl when they aren't using Pg.
551119,normal,Single table output in bugzilla
551146,normal,Changing bugzilla email labels
551199,major,"""datetime_format_inbound"" not found when calling Bug.search()"
551210,normal,Retargetted flags should be deleted if the flag setter has no privs to set the flag in the new product
551398,normal,Undef to trick_taint at Bugzilla/Util.pm line 62
551426,minor,percentage_complete missing in the xml output
551651,normal,$cgi->query_string is returning POST variables when it really shouldn't be
551977,normal,[bugzilla 3.4.6] Buglist: show custom field
552167,normal,show_bug.cgi loads a bunch of flagtypes from the database over 60 times on a single page load
552168,minor,Displaying bug comments loads users one at a time
552299,normal,Bugzilla does not handle IPv6 loopback address for localhost (::1)
552313,normal,usability enhance
552349,normal,A lot of errors are thrown when an Atom feed queries Bugzilla
552353,normal,HTTP_TRANSFER_ENCODING is undefined when using WebServices
552676,major,"""Change several bugs at once"" mechanisem doesn't work"
553255,normal,config.cgi is extremely slow with lots of products
553266,major,config.cgi?ctype=rdf spends most of its time loading flagtypes from the database
553279,normal,Sort by product with useclassification on includes product in select twice
553422,normal,"I requested assignment of a new password, >24hrs later no email"
553591,major,Custom field value visibility by Status or Resolution does not work
553770,normal,JSON-RPC WebService displays an HTML page when login is required but not provided
553774,critical,User.login does not return any cookies under the JSON-RPC WebService
553818,major,Bug.attachments has the wrong return value format
553913,normal,Many errors that the WebService can throw lack a specific error code
553923,minor,JSON-RPC errors have newlines in them
554052,normal,Can't change email parameters if mailer queue Perl modules are not installed even if use_mailer_queue is off
554086,major,undef error - Not an ARRAY reference at Bugzilla/Object.pm line 202 after reassigning or closing bugs
554409,major,"Scrolling down in bug list after ""dates changed between x and y"" in IE leads to error webpage"
554523,blocker,Release Bugzilla 3.6
554536,normal,"Bug.fields should not be sending the ""values"" item for fields that cannot have values"
554560,normal,Bug.fields has inconsistent visibility_values behavior for the values of built-in select fields
554569,normal,Bug.fields: requesting one field by both name and id returns it twice
554714,normal,"If JSON-RPC dies before method evaluation, errors aren't thrown properly"
554729,minor,User.login in the WebService returns (invalid) cookies when called with bad arguments
554948,normal,Error - Nested quantifiers in regex; when URL contains ++ and user is logged out.
554986,major,Searching Quicksearch using the minus sign operator doesn't work
555318,minor,Login after Password Recovery token issues.
555422,normal,Email::Address is missing from the list of required modules
555424,normal,Reinstate Up/First/Last/Prev/Next <link rel> tags
555538,minor,Unable to add the data in the proper format in the Excel cell (ALT+ENTER Doesn't work)
555931,normal,Need to Install Bugzilla on Windows 2000
555955,normal,Bugzilla CSS throws lots of warnings on Mozilla error console
555984,trivial,Minor typo in edit-multiple JavaScript
556000,trivial,Bugzilla should admit to not being able to search pieces of words
556021,trivial,Bug bareword on request queue page
556045,normal,get_bug_link() requests the localized bug status and resolution too many times
557345,normal,"Edit Bug - Change Product, Components Does Not Update"
557385,blocker,Update the 3.6 Release Notes for the final release
557399,normal,"""use Switch"" is deprecated"
557495,normal,PostgreSQL crashes when deleting a custom field of type BugID
557686,normal,PostgreSQL crashes when deleting a custom field of type Date/Time
557763,normal,default assignee and default qa contact show as '1' and '1' for plugins:.NET (Microsoft)
557769,normal,install-module.pl fails to install DateTime::Locale on RHEL5.2
557806,minor,"When setting the upgrade_notification parameter, an error should be thrown if you don't have all the required Perl modules installed"
557911,normal,"""Don't notify"" Check box when submitting"
558032,minor,"Incorrect ""X votes"" link when viewing a bug"
558199,trivial,Unused variable in Search.pm
558285,normal,gff
558696,normal,"After committing a change, the addressbar changes to https://bugzilla.mozilla.org/process_bug.cgi and prevents refreshing"
558811,normal,would someone please explain this graph
559026,normal,Insecure dependecy in parameter while running with -T switch
559245,major,Internal error when attempting to browse the Administration>Parameters page
559573,normal,"3.6 release notes state that email_in.pl supports attachments now, but the pod docs say otherwise"
559631,normal,checksetup.pl doesn't say anything about perl module List-MoreUtils-0.22
559718,normal,"Bugzilla fails to install modules because of ""Can't call method ""cpan_method"" on an undefined value"""
559988,blocker,Release Bugzilla 3.4.7
560029,normal,輸入不存在使用者id，訊息提示錯誤
560161,trivial,Minor typo in Quicksearch help file
560215,minor,cannot attach any file if maxattachmentsize is 0
560318,major,install-module.pl fails to install DateTime with modern versions of Module::Build and CPAN
560330,normal,Installing DateTime with install-module.pl fails if Module::Build isn't installed
560545,normal,[Oracle] Search.pm calls sql_fulltext_search with duplicate labels
560691,normal,install-module.pl sometimes prompts the user for input when it doesn't need to
560773,minor,Administration > Parameters > Attachment > maxattachmentsize cannot be 0?
560817,normal,Can't add charts for .NET component (leading periods give bugzilla in-dot-gestion)
560862,trivial,defined(%hash) is deprecated in Perl 5.12
560891,normal,report.cgi: 403 Forbidden error when requesting tabular or graphical report.
561041,minor,invoking email_in.pl from the mail queue under suid fails due to insecure chdir
561067,major,"Our 'List Results' ""Change Columns"" redirect results in un-rendered page"
561170,minor,Various warnings thrown when running QA tests with Perl 5.12.0
561213,minor,Large attachment results in blank page - no error reported
561322,normal,Bugzilla reveals database password on error
561348,normal,"Bugzilla's bz_smallminded ""This list is too long for Bugzilla's little mind"" isn't working with Gecko because ':' is encoded"
561379,major,Upgrading from 3.4.4 to 3.6 fails with ORA-01400
561465,normal,User passwords containing commas do not allow proper login
562888,normal,Bug.create via XML-RPC times out when assigned_to is set
563144,normal,advanced search excluding specific keywords does not report bugs without any keywords
563571,critical,Fields in DB not found after upgrade to 3.6
563894,trivial,Milestone URL needs to be removed from documentation
564160,normal,Not localized strings
564433,normal,How localize strings
564629,normal,In the charts aren't displayed national characters
564650,normal,Email_in not using UTF-8
565002,major,"Sending e-mail is crashed.  In apache log ""... Error: no valid recipients"""
565145,blocker,Invalid Parameter 'in_new_bugmail' error after submitting a new bug
565240,normal,colchange.cgi shouldn't send full-page content after its redirect() call
565314,normal,"Cannot remove dependency for fixed bug where blocker is reopened, but can remove block from reopened bug"
565364,trivial,Arrows missing from buttons in change columns screen
565790,blocker,Unprivileged users cannot create bugs anymore
565794,critical,Comments are no longer displayed
565880,normal,Do not throw an error when obsoleting an already obsolete attachment
565920,blocker,Update the Downloads page to also have Bzr instructions
565942,normal,"Bugs can't be changed to the ""Reopened"" status when they went directly from ""Unconfirmed"" to ""Resolved""."
566069,normal,Add an attachment from text input box
566195,blocker,Release Notes for Bugzilla 3.6.1
566198,blocker,Release Notes for Bugzilla 3.4.7.
566199,blocker,Release Notes for Bugzilla 3.2.7
566276,normal,xml packet always return 0 from assigned_to
566299,normal,Linkification of bug#12345 and MR#12345 in Bugzilla
567303,critical,VALIDATOR_DEPENDENCIES doesn't always sort field validation properly
567629,major,"Can't open perl script ""\x96T"": No such file or directory\r"
567670,blocker,"Security Advisory for Bugzilla 3.7.1, 3.6.1, 3.4.7 and 3.2.7"
567671,normal,"Test::Taint throws a warning every time it's loaded, on perl 5.10"
567729,normal,Bugzilla stores LDAP user password
567953,normal,There are duplicate components in the tail of the tabular report
567981,normal,Restore ability for page.cgi pages to contain . characters
567996,normal,All products are selectable in advanced search form
568019,normal,needs help pls : BugZilla LDAP Authentications
568158,normal,"Clicking 'Whining"" on Bugzilla Admin page displays Error message"
568220,normal,Can't search on priorities containing whitespace
568503,normal,config.cgi does not set a charset in Content-Type
569199,normal,Running Cron command for Whining displayed error message
569385,normal,Incompatible with SOAP-Lite-0.711
570441,normal,Canceling my own review request with a new attachment shouldn't send an email
570567,minor,Keyword deleted page does not mention the deleted keyword
570987,minor,"Argument """" isn't numeric in numeric gt (>) at template/en/default/bug/field-label.html.tmpl line 34"
571003,minor,After changing the default milestone name the Action 'Delete' shows up for the default
571498,major,After reseting password and changing password system doesn't allow to login
571636,normal,Search UI should follow a grid design
571637,minor,Custom Search should be behind a show/hide widget
571820,major,G41 LAN Realteck RTL8111DL Gigabit Ethernet controller works Intermittently
571928,normal,bugzilla emails for blocks or depends on changes should include bug summary along with number of bug added/removed
572108,minor,"buglist.cgi: Use of uninitialized value $2 in uc at Bugzilla/Search.pm line 1184, <DATA> line 275., referer: https://***/describecomponent.cgi"
572110,minor,"buglist.cgi: Use of uninitialized value in lc at Bugzilla/Search.pm line 391, <DATA> line 275., referer: https://***/describecomponents.cgi"
572384,normal,When creating a new User account in Bugzilla the email shown is not encoded correctly (for examle the Subject is not shown and Umlaute are not shown correctly
572393,major,The UI of pages is broken in Opera 10.60
572407,normal,Products in Search-Drop-down-list
572423,normal,"""My requests"" is empty"
572603,critical,"If $action eq 'none' in process_bug.cgi, recent_search_for dies"
573441,normal,The attachments.ispatch column is a boolean without a DEFAULT
573450,normal,keyworddefs.description should be NOT NULL
573451,normal,Customizing Bugzilla whine e-mail template
574029,normal,"The red star besides the ""Component"" label in show_bug.cgi has no meaning"
574166,normal,clean_search_url needs to take into account email3 fields.
574566,normal,"""reporter"" is missing from OPERATOR_FIELD_OVERRIDE in Bugzilla::Search"
574892,major,Initial CC and Default QA Contact not set on bugs if the arguments are not passed to Bugzilla::Bug->create
574895,blocker,Release Bugzilla 3.7.2
574896,blocker,Security Advisory for Bugzilla 3.7.2
574940,minor,percentage_complete searches fail on PostgreSQL
575021,minor,anyexact doesn't properly trim values in the list
575022,minor,anyexact percentage_complete searches return every bug in the database
575097,blocker,Cannot display bugs (STS problem?)
575454,trivial,Extra whitespace makes link look bad on index.cgi
575475,normal,ANSI coloring breaks displaying of actual error message during checksetup template precompiling
575497,minor,Error after changing email address if still logged in.
575499,trivial,New advanced search page has a few text-related issues
575501,normal,Custom field doesn't appear when a field it's dependent on appears with a default value
576060,minor,[SECURITY] checksetup.pl with $use_suexec=1 sets .bzr/ and data/webdot/ as world readable
576105,normal,install-module.pl cannot install DateTime or DateTime::TimeZone on Windows
576230,normal,System doesn't attach files during creation of letter.
576231,normal,"All emails are sent only to the administrator , even after adding other users to the aggigned and cc list"
576481,critical,Item not saving
576865,normal,"Bugzilla doesn't detect a browser is x86_64, Build Identifier not always filled in automatically"
576871,normal,Build Identifier not always filled in automatically
576911,minor,"The ""before_table"" hook throws ""uninitialized value"" errors in the web server log"
576912,normal,"Clicking ""Submit Bug"" with the Summary field focused doesn't work because the UI moves"
576916,minor,'keywordaction' is undefined when editing a single bug
576969,normal,Keyword autocompletion doesn't work with charts and reports
577037,major,convert-workflow causes IN_PROGRESS to have a lower sortkey than CONFIRMED
577049,normal,"The next release is 4.0, not 3.8"
577053,major,Upgrading from 2.18 or earlier fails with the new status workflow patch
577054,normal,Cannot delete any field value if that value's field controls any values
577058,normal,collectstats.pl --regenerate fails on PostgreSQL
577080,normal,"bugzilla-3.7.2.tar.gz is 17 Mb in size, much bigger than the usual ~2 Mb for older releases"
577089,normal,Series (new charts) are not updated when running convert-workflow.pl
577149,normal,convert-workflow should rename values in saved searches
577388,normal,xt/search.t incorrectly fails target milestone tests
577407,normal,Several HTML elements have the same ID when editing parameters
577412,minor,Obsolete links pointing to editparams.cgi
577415,normal,Allow positional parameters for XML-RPC
577453,normal,Bugzilla internal error on login
577538,major,xt/search.t does not pass on PostgreSQL
577557,normal,"PostgreSQL cannot test injection with integer columns, for xt/search.t"
577569,minor,[PostgreSQL] longdescs.isprivate casesubstring searches fail with a SQL error
577574,minor,"When creating a new component and an error is thrown, the default roles are cleared"
577575,normal,[PostgreSQL] Having percentage_complete as a buglist column requires having remaining_time in GROUP BY
577577,normal,bz_drop_fk should be tolerant of failure
577582,normal,[PostgreSQL] Can't use changedfrom/to on longdescs.isprivate
577588,normal,xt/search.t is sometimes not properly translating values
577602,major,[PostgreSQL] Can't use multi-selects as buglist columns
577754,normal,"Updating bugs_fulltext is really, really slow"
577765,normal,Positional Parameters in XMLRPC only accepts the first param.
577853,normal,"Implement ""Related Bugs"" field for local bugs that are not dependencies"
577903,major,bugbot doesn't parse flag requests correctly anymore
577956,major,Bugs which were never confirmed cannot be reopened as UNCONFIRMED
578036,normal,Error: Hours Left field is less than the minimum allowable value when no estimates
578197,minor,[PostgreSQL] Fix old altered-to-serial columns that weren't upgraded as well as they could have been
578241,trivial,Use the same ID in enter_bug.cgi and show_bug.cgi for group checkboxes
578253,normal,Autocomplete user names in the UI to add users to watch
578256,normal,Autocomplete user names in the search UI
578258,normal,"Calling votes.cgi with no arguments should either display the user's votes, or give a better error message if the extension is disabled"
578267,minor,Fix a few minor UI issues with the new keyword autocomplete changes
578324,normal,"The ""Hours Left"" field in show_bug.cgi rejects all values passed to it"
578335,normal,"The ""Show next bug in my list"" user pref either doesn't display the next bug or display one from the wrong buglist"
578366,trivial,closing </dl> is missing in pages/fields.html.tmpl
578433,normal,"Can't call method ""id"" without a package or object reference at Bugzilla/Component.pm line 98"
578513,normal,cc_accessible and reporter_accessible should be is_cc_accessible and is_reporter_accessible in the WebServices
578572,normal,User autocomplete ignores letters typed while a response is pending
578599,minor,Hard to scroll past the attachment view in the details screen
578745,normal,Edit classification is missing a reclassify link for Unclassified with a single product
578787,normal,Email addresses are available to anybody who has an account
578815,normal,Almost impossible to efficiently search for 'all my posts'
578958,normal,Sanity check doesn't send unsent mails to addresses form CC list
578962,normal,mail crashed
579189,minor,New methods added to Bugzilla/User.pm by bug 24896 have no POD
579214,normal,"Quicksearch with ""owner:"" is broken"
579218,normal,Email notifications shouldn't assume a fixed-width font
579292,major,"""Hours Worked is greater than 0"" boolean chart crashes"
579367,normal,"Simple search fails for bug alias (Search for Open, Thunderbird, ""Alias"")"
579695,normal,xt/search.t: MULTI_SELECT fields intermittently fail the casesubstring-lc test
579749,normal,Linkify URLs found in attachments (restore the is_url behavior)
579797,blocker,Bugzilla::Group::ValidateGroupName() has been removed despite some scripts still use it
579915,normal,tog-pegasus conflicts with libcmpiCppImpl0-2.0.0Dell-1.1.el5.i386
580214,blocker,"Security Advisory for Bugzilla 3.7.3, 3.6.2, 3.4.8 and 3.2.8"
580366,normal,Use of uninitialized value in split at Bugzilla/Util.pm
580500,critical,Precompiling templates...file error - parse error - account/created.html.tmpl line 37: Assertion ((svtype)((_svi)->sv_flags & 0xff)) >= SVt_RV failed
580761,critical,YUI scripts no longer work
580778,normal,hash keys containing non-word characters such as dashes are dropped from web service params
580865,normal,'Edit' not a clear way of getting to old/advanced attachment view
581189,normal,Full usernames do not appear in whine mails
581311,normal,Various documentation in Bugzilla::Hook is out of date
581316,trivial,Minor typos in notification reason descriptions
581326,minor,Misleading JSON error message
581327,major,"Lists of bugs (aka tags) are broken, because bug IDs are no longer split on commas"
581422,trivial,Tweak attachment detail view
581446,normal,Add me to the bug's CC list if I'm commenting on an attachment
581448,normal,The status field in the table of possible duplicates is not localizable
581622,major,"When a quicksearch includes the ""content"" field, it is limited to 200 bugs"
581663,minor,Directive closed twice
581668,normal,Obsolete groups have no name nor ID when moving a bug to another product
581690,normal,Restore the ability to move several bugs at once to another installation
581693,trivial,Missing whitespace for the auth_failure_action hook
581798,minor,Remove whitespaces from URLs when listing classifications and products in editproducts.cgi
581933,normal,Username autocomplete doesn't work outside ASCII
582209,normal,[Oracle] Bugzilla::DB::Oracle adjust_statement LIMIT code corrupts sub-selects
582339,trivial,Wrong spelling at bugzilla's documentations on Groups and Group Security Section
583154,normal,"If you don't comment while setting the work_time (Hours Worked) field, you get an empty comment in bugmails"
583165,normal,Un(setting) a comment as private doesn't update bugs.delta_ts
583167,normal,"The ""X-Bugzilla-Changed-Fields:"" header in bugmails is unreadable"
583287,normal,Some fields should not be displayed in bugmail for new bugs
583535,trivial,wrap entire line in the Bug List with a <A HREF
583614,critical,Simple Search no longer works
583622,normal,email_in.pl doesn't let me set timetracking fields
583645,critical,[PostgreSQL] Many searches on Pg fail with a taint error
583646,normal,wrong summary on bugzilla quicksearch results page when product/component shortcut is used
583649,blocker,Release Notes for Bugzilla 3.6.2
583690,normal,Crash if I type 'bug 4294967296' in comments for bug
583778,normal,Add the option to edit a bug /comment you already reported
583884,critical,User autocomplete fills in empty values instead of the autocomplete value
584018,minor,"@foo= bar in email_in.pl is not parsed correctly, due to a missing whitespace before ""="""
584021,minor,FILTER txt should also remove &nbsp;
584032,normal,Cannot set requestees on bug creation
584036,minor,_sync_fulltext() not called when (un)setting an existing comment as private
584069,major,IE6 throws many JS errors
584110,normal,"Don't name attachment files ""attachment.txt"" by default, because this confuses IE"
584414,normal,With the latest Bugzilla it is no longer possible to search for bugs with at least x votes
584427,minor,"""Only bugs with at least X votes"" should not be in the ""Search by People"" section of query.cgi"
584428,blocker,Release Notes for Bugzilla 3.4.8
584429,blocker,Release Notes for Bugzilla 3.2.8
584739,major,Email Sent To: No One
585028,normal,QuickSearch: Advanced Shortcut for Priority (P1-P5 as search word) broken (e.g. buglist.cgi?quicksearch=P1+:Bugzilla)
585031,normal,"Search including ""Any of"" assignee or reporter behaves as an AND instead of OR"
585055,normal,Error load custom fields using template portuguese language
585454,minor,"In flagmail, the Date header field splits the Subject header field in two"
585490,normal,Italics for UNCONFIRMED bug links are hardcoded in Bugzilla/Template.pm
585498,normal,RADIUS auth isn't experimental any more
585633,major,checksetup.pl detects wrong version of perl modules
585650,critical,"got cf_ciphase doesn't exist problem when upgrading from 3.2.3 -> 3.6.2,"
585802,normal,Change the cc/user autocomplete (and backend) usermatching to ignore spaces / search on space separated names
585825,normal,RFE: Redirect to a permanent URL after submitting any form.
585852,trivial,"Error message for file_too_large mentions ""non-patch attachments"" when there is no such thing anymore"
585878,critical,Filing first bug crashes Bugzilla
585938,normal,editproducts.cgi and show_bug.cgi report internal error for product with more than 502 versions
586011,normal,Change references to 'DarwinPorts' to 'MacPorts' (proper project name)
586244,normal,The docs should mention mod_expires and mod_headers Apache modules
586497,major,"Cannot create flags.  Receive error ""DBD::mysql::db do failed: Duplicate entry '0' for key 1 """
586871,minor,Convert all Bugzilla->get_fields calls to Bugzilla->fields
586911,normal,Status and resolution unlocalizable in list of potential duplicates
586951,normal,Saved Searches broken when product name updated
587568,normal,Cannot get bug details
588365,normal,"Hours worked, Email notification, timetracking"
588368,normal,custom mapping for some fields in 3.6 are missing
588483,normal,Can't call bug.defined in templates
589100,major,"Bug with keywords in Bugzilla/Bug.pm, causes errors"
589424,normal,possible wrong description for group control examples
589463,normal,Version is now multi-selectable field.
589525,minor,"Useless text ""text"" at line 1821 of administration.xml"
590901,trivial,incorrect formating in opera-10.61
591218,normal,"""Form field longdesclength was not defined"" error while mid-airing again after clicking ""Submit only my new comment"" on mid-air page"
591535,normal,"""Give me some help"" link is no longer necessary, on Bugzilla 4.0"
591610,normal,Custom field doc doesn't include 'Bug ID' type
591636,normal,'Is Mandatory' is not documented at Adding Custom Fields
591638,minor,Editing 'Field Values' is documented as 'Legal Values'
591641,trivial,Confusing wording of explanation of privileges on edituser (canedit vs. canconfirm)
591781,minor,'Voting' section remains in docs
591865,trivial,Test Bug
592012,normal,its no longer possible to edit attachment flags (such as 'patch')
592480,normal,Only one person is added to CC list when multiple are specified
593170,minor,"see_also field incorrectly allows urls like ""show_bug.cgi?id=2323"" (with no domain)"
593173,normal,Local bug linking in see_also should work whether somebody inputs an https or http URL
593881,trivial,Assignment to $[ has been deprecated in Perl 5.12.0
593887,normal,Perl 5.14 requires HTML::Parser 3.67 and DBI 1.614
594155,normal,IE6 throws JS errors when filing new bugs
594518,normal,The Edit Attachment as Comment corrupts the attachment if it's a UTF-8 text file
594527,trivial,"""You are receiving this mail because:"" email footer has dubious English grammar"
594947,normal,show_bug text boxes are not 100% width
594970,normal,Can't change the mimetype for a patch
594990,normal,Strict-Transport-Security header makes it impossible to disable ssl_redirect and makes entire domain strict
595380,normal,Manually-inserted <script src> tags are missing the mtime filter
595410,normal,Displaying a bug with many dependencies is slow
595712,normal,Return to bug page after login doesn't work with javascript disabled
595735,normal,Don't allow regular users remove other CC'd emails except their own
596740,major,xlsx files are corrupted sometimes when downloading as attachment
597683,minor,CreateAccount page displaying error message
597762,normal,The new messages for missing field values for bugs are not too visible as they should be
597772,minor,Bugzilla::Bug::add_see_also does not check for undef input
597779,normal,Advanced search for more than one keyword doesn't work
597833,normal,Add ability to find bugs considering synonyms and anthonyms words in title
598147,normal,"Can't call method ""isa"" without a package or object reference at ./email_in.pl line 377."
